{
  "config_version": "2.0.0",
  "oak_module": {
    "hardware_config": {
      "model_path": "assets/test_config/yolov8.blob",
      "label_map": [
        "durian",
        "person"
      ],
      "num_classes": 2,
      "confidence_threshold": 0.5,
      "nms_threshold": 0.4,
      "max_detections": -1,
      "rgb_resolution": [
        1920,
        1080
      ],
      "preview_resolution": [
        512,
        288
      ],
      "hardware_fps": 20,
      "usb2_mode": true,
      "enable_depth_output": true,
      "depth_resolution": [
        640,
        400
      ],
      "depth_min_threshold": 400,
      "depth_max_threshold": 6000,
      "align_depth_to_rgb": true,
      "median_filter": 5,
      "left_right_check": true,
      "extended_disparity": false,
      "subpixel": false,
      "queue_max_size": 4,
      "queue_blocking": false
    },
    "role_bindings": {
      "left_camera": {
        "role": "left_camera",
        "historical_mxids": [
          "19443010C122201300"
        ],
        "MAX_HISTORICAL_MXIDS_LENGTH": 5,
        "active_mxid": null,
        "last_active_mxid": "19443010C122201300"
      },
      "right_camera": {
        "role": "right_camera",
        "historical_mxids": [
          "19443010F1221E1300"
        ],
        "MAX_HISTORICAL_MXIDS_LENGTH": 5,
        "active_mxid": null,
        "last_active_mxid": "19443010F1221E1300"
      }
    },
    "device_metadata": {
      "19443010C122201300": {
        "mxid": "19443010C122201300",
        "product_name": "OAK-D S2 AF",
        "connection_status": "connected",
        "notes": "自动发现于 2026-03-02 16:48:34",
        "first_seen": 1772441311.250893,
        "last_seen": 1772441311.250893
      },
      "19443010F1221E1300": {
        "mxid": "19443010F1221E1300",
        "product_name": "OAK-D-S2-FF",
        "connection_status": "connected",
        "notes": "自动发现于 2026-03-02 16:48:38",
        "first_seen": 1772441311.250893,
        "last_seen": 1772441311.250893
      }
    }
  },
  "data_processing_config": {
    "coordinate_transforms": {
      "left_camera": {
        "role": "left_camera",
        "translation_x": 0.0,
        "translation_y": 0.0,
        "translation_z": 0.0,
        "roll": 0.0,
        "pitch": 0.0,
        "yaw": 0.0,
        "calibration_date": null,
        "calibration_method": null
      },
      "right_camera": {
        "role": "right_camera",
        "translation_x": 0.0,
        "translation_y": 0.0,
        "translation_z": 0.0,
        "roll": 0.0,
        "pitch": 0.0,
        "yaw": 0.0,
        "calibration_date": null,
        "calibration_method": null
      }
    },
    "filter_config": {
      "filter_type": "moving_average",
      "moving_average_config": {
        "window_size": 5
      }
    },
    "decision_layer_config": {
      "person_label_ids": [
        1
      ],
      "person_warning": {
        "d_in": 3000.0,
        "d_out": 3050.0,
        "T_warn": 3.0,
        "T_clear": 3.0,
        "grace_time": 0.5
      },
      "object_zones": {
        "danger_y_threshold": 1500.0,
        "grasp_zone": {
          "mode": "rect",
          "x_min": -200.0,
          "x_max": 2000.0,
          "y_min": 1550.0,
          "y_max": 2500.0,
          "r_min": null,
          "r_max": null
        }
      },
      "state_expiration_time": 1.0
    },
    "enable_data_logging": false,
    "processing_thread_priority": 5,
    "person_timeout_seconds": 5.0
  },
  "can_config": {
    "enable_can": false,
    "can_interface": "socketcan",
    "can_channel": "can0",
    "can_bitrate": 250000,
    "send_timeout_ms": 100,
    "receive_timeout_ms": 200,
    "enable_auto_configure": true,
    "sudo_password": "orangepi",
    "alert_interval_ms": 500,
    "frame_ids": {
      "frames": {}
    }
  },
  "display_config": {
    "enable_display": true,
    "default_display_mode": "rgb",
    "enable_fullscreen": false,
    "window_width": 1920,
    "window_height": 1080,
    "window_position_x": 0,
    "window_position_y": 0,
    "target_fps": 20,
    "enable_vsync": false,
    "show_detection_boxes": true,
    "show_labels": true,
    "show_confidence": true,
    "show_coordinates": true,
    "show_fps": true,
    "show_device_info": true,
    "normalize_depth": true,
    "bbox_thickness": 2,
    "bbox_color_by_label": true,
    "text_scale": 0.6
  },
  "system_config": {
    "log_level": "INFO",
    "log_to_file": true,
    "log_file_path": "log",
    "log_max_size_mb": 100,
    "log_backup_count": 7,
    "log_rotate_mode": "time",
    "log_rotate_when": "MIDNIGHT",
    "log_rotate_interval": 1,
    "log_rotate_utc": false,
    "enable_profiling": false,
    "max_worker_threads": 4,
    "auto_reconnect": true,
    "reconnect_interval": 5.0,
    "max_reconnect_attempts": 10,
    "graceful_shutdown_timeout": 5.0
  }
}